{
  "$schema": "https://json-schema.org/draft/2020-12/schema",
  "$id": "https://spa-platform.internal/contracts/infra-outputs.schema.json",
  "title": "Infrastructure outputs",
  "description": "infra/envs/poc/outputs.json, written by workstream 1 after every apply. The scripts and the deployed tests read it, and none of them reads Terraform state. Workstream 1 proposes this contract; the integrator writes it. Source: docs/plan/02-contracts.md -> Infrastructure outputs. Freezes at G1a.",
  "x-freeze": { "gate": "G1a", "status": "frozen-at-g1a" },
  "type": "object",
  "additionalProperties": false,
  "required": [
    "region",
    "cell",
    "bucket",
    "albDnsName",
    "ecsCluster",
    "ecsService",
    "ecrGateway",
    "ecrMockApi",
    "gatewayImage",
    "issuer",
    "cognitoDomain",
    "clients",
    "testUsers",
    "logGroup"
  ],
  "properties": {
    "region": {
      "type": "string",
      "pattern": "^[a-z]{2}(-[a-z]+)+-[1-9][0-9]*$",
      "description": "The AWS region. Every price in the cost model is for us-east-1."
    },
    "cell": {
      "$ref": "https://spa-platform.internal/contracts/registry.schema.json#/$defs/appId",
      "description": "The cell name, the same value as Platform:Cell. It is part of every resource name and of the data-protection application name, so it takes the same lexical form as an appId."
    },
    "bucket": {
      "$ref": "#/$defs/bucketName",
      "description": "The one private bucket: the registry and every release."
    },
    "albDnsName": {
      "$ref": "#/$defs/dnsName",
      "description": "The internal load balancer's DNS name. The tunnel forwards to it."
    },
    "ecsCluster": { "$ref": "#/$defs/awsName" },
    "ecsService": { "$ref": "#/$defs/awsName" },
    "ecrGateway": {
      "$ref": "#/$defs/repositoryUri",
      "description": "The gateway image repository, with immutable tags."
    },
    "ecrMockApi": {
      "$ref": "#/$defs/repositoryUri",
      "description": "The mock API image repository, with immutable tags."
    },
    "gatewayImage": {
      "type": "string",
      "pattern": "^[a-z0-9][a-z0-9.-]*(:[1-9][0-9]*)?/[a-z0-9][a-z0-9._/-]*@sha256:[0-9a-f]{8,64}$",
      "description": "The running gateway image, pinned by digest. Deployment pushes by digest and then asserts the running one, so a tag never decides what runs. The digest in the example document is abbreviated to eight hex characters; a real one has sixty-four."
    },
    "issuer": {
      "type": "string",
      "pattern": "^https://[^\\s]+$",
      "description": "The identity provider's issuer, the value behind Issuers:{name}:Authority."
    },
    "cognitoDomain": {
      "$ref": "#/$defs/dnsName",
      "description": "The managed-login prefix domain, host only and no scheme. Issuers:{name}:BrowserOrigin is https:// plus this value."
    },
    "clients": {
      "type": "object",
      "description": "One entry per app that has an OAuth client, keyed by appId. spactl app add reads it to complete an app definition.",
      "propertyNames": { "$ref": "https://spa-platform.internal/contracts/registry.schema.json#/$defs/appId" },
      "additionalProperties": {
        "type": "object",
        "additionalProperties": false,
        "required": ["clientId", "secretParameter", "secretVersion"],
        "properties": {
          "clientId": { "$ref": "https://spa-platform.internal/contracts/registry.schema.json#/$defs/clientId" },
          "secretParameter": {
            "$ref": "#/$defs/parameterName",
            "description": "The Parameter Store name holding the client secret. Never the value: this file is written to the repository's working tree and read by scripts."
          },
          "secretVersion": {
            "type": "integer",
            "minimum": 1,
            "description": "The parameter version. A rotation raises it, and the registry entry's clientSecretRef follows."
          }
        }
      }
    },
    "testUsers": {
      "type": "object",
      "description": "The pool's test users, keyed by user name. Each names the parameter its generated password lives in, never the password.",
      "propertyNames": { "type": "string", "minLength": 1, "maxLength": 128, "pattern": "^[a-z0-9]([a-z0-9._-]*[a-z0-9])?$" },
      "additionalProperties": {
        "type": "object",
        "additionalProperties": false,
        "required": ["passwordParameter"],
        "properties": {
          "passwordParameter": { "$ref": "#/$defs/parameterName" }
        }
      }
    },
    "logGroup": {
      "type": "string",
      "minLength": 1,
      "maxLength": 512,
      "pattern": "^/[A-Za-z0-9._/#-]+$",
      "description": "The task's CloudWatch log group. The deployed tests read the gateway log for a run from here."
    }
  },
  "$defs": {
    "bucketName": {
      "type": "string",
      "minLength": 3,
      "maxLength": 63,
      "pattern": "^[a-z0-9][a-z0-9.-]*[a-z0-9]$"
    },
    "dnsName": {
      "type": "string",
      "minLength": 1,
      "maxLength": 255,
      "pattern": "^[a-z0-9]([a-z0-9-]*[a-z0-9])?(\\.[a-z0-9]([a-z0-9-]*[a-z0-9])?)+$"
    },
    "awsName": {
      "type": "string",
      "minLength": 1,
      "maxLength": 255,
      "pattern": "^[A-Za-z0-9][A-Za-z0-9_-]*$"
    },
    "repositoryUri": {
      "type": "string",
      "pattern": "^[a-z0-9][a-z0-9.-]*(:[1-9][0-9]*)?/[a-z0-9][a-z0-9._/-]*$"
    },
    "parameterName": {
      "type": "string",
      "minLength": 1,
      "maxLength": 1011,
      "pattern": "^/[A-Za-z0-9][A-Za-z0-9._/-]*$"
    }
  }
}
